{
  "schemaVersion": "bonded-task-envelope/v1",
  "envelopeId": "env_code_patch_001",
  "envelopeHash": "0x155d061e3019da9ae3fd0052dd4d4916eb7991061c7f7eaa3891388c10f0f62c",
  "requesterId": "requester_fixture_001",
  "agentId": "agent_code_001",
  "verifierId": "verifier_ci_001",
  "confirmingVerifierId": "verifier_confirming_001",
  "task": {
    "taskClass": "code.patch",
    "title": "Fix deterministic fixture issue",
    "description": "Produce an objective evidence-backed deliverable for a bonded task fixture.",
    "objectiveOnly": true,
    "deliverableType": "git_patch",
    "expectedOutputSchema": "flowmemory.task_bond_evidence.v1",
    "acceptedOutputModes": [
      "patch",
      "test_log"
    ]
  },
  "policy": {
    "policyId": "objective-code-low-risk-confirmed",
    "policyHash": "0xb620665c5e733c732f34d5e98caaa5a963f06202b1b2cb336b96d1869bdb60e9",
    "riskTier": 1,
    "requiredConfirmations": 1,
    "submissionWindowSeconds": 86400,
    "disputeWindowSeconds": 86400,
    "graceWindowSeconds": 3600,
    "evidenceAvailabilityWindowSeconds": 604800
  },
  "economics": {
    "settlementToken": "0x833589fCD6eDb6E08f4c7C32D4f71b54bdA02913",
    "settlementTokenSymbol": "USDC",
    "settlementChainId": 8453,
    "payoutUSDC": "50000000",
    "agentBondUSDC": "10000000",
    "verifierFeeUSDC": "2500000",
    "requesterCancelBondUSDC": "1000000",
    "disputeBondUSDC": "5000000",
    "protocolFeeUSDC": "0"
  },
  "acceptanceCriteria": [
    {
      "id": "ci",
      "type": "ci_passes",
      "description": "Configured tests pass against submitted patch.",
      "required": true,
      "verifierInstructions": "Run the declared test command and compare output hash."
    }
  ],
  "evidence": {
    "requiredEvidenceSchema": "flowmemory.task_bond_evidence.v1",
    "acceptedEvidenceTypes": [
      "git_commit",
      "test_log",
      "artifact_hash"
    ],
    "evidenceCommitmentRequired": true,
    "availabilityProofRequired": true,
    "redactionAllowed": true
  },
  "recourse": {
    "noSubmission": "refund_and_slash",
    "invalidSubmission": "refund_and_slash",
    "unsupportedTask": "refund_without_slash",
    "verifierError": "overturn_and_slash_verifier",
    "requesterBadFaithChallenge": "slash_dispute_bond"
  },
  "payment": {
    "fundingMode": "manual_fixture"
  },
  "a2a": {
    "contextId": "ctx_fixture_001",
    "taskId": "a2a_task_001",
    "messageId": "msg_001",
    "agentCardUrl": "https://example.invalid/.well-known/agent-card.json"
  },
  "mcp": {
    "originServer": "https://example.invalid/mcp",
    "originTool": "code.patch",
    "toolCallId": "tool_call_001"
  },
  "timestamps": {
    "createdAt": "2026-05-21T12:00:00.000Z",
    "expiresAt": "2026-05-22T12:00:00.000Z"
  },
  "signatures": [
    {
      "signer": "0x1000000000000000000000000000000000000001",
      "role": "requester",
      "algorithm": "fixture-ed25519",
      "signature": "fixture-signature",
      "signedAt": "2026-05-21T12:00:00.000Z"
    }
  ]
}
